{
  "slug": "blue-dissolve",
  "theme": "夜の人物の輪郭が青く発光する煙となって解けていく — 赤青の警察灯に照らされたサイバーパンク・スリラーの1カット",
  "status": "submitted",
  "attempts": {
    "brief": 1,
    "order": 1,
    "implement": 1,
    "runtime": 1,
    "aesthetic": 3
  },
  "last_error": [
    {
      "path": "invariants[5]",
      "rule": "aesthetic",
      "severity": "error",
      "message": "debug4のSDF帯が全周一様幅で、部位による侵食深さの差が皆無; debug1のシルエットが完全に無傷で、縁の後退(溶け)が確認できない; 静止画のため2時間スケール(溶ける/戻る)は原理的に検証不能",
      "hint": "運動場で侵食の「深さ」自体を変調すること: フレーム差分をEMA(α=0.15)した運動場をシルエットしきい値に加算し、速く動いた部位でSDF帯がシルエット内側へ食い込むようにする。侵食深さ係数を+50%から試し、debug4で帯幅が部位により2倍以上変化して見えるまで上げる"
    },
    {
      "path": "invariants[5]",
      "rule": "aesthetic",
      "severity": "error",
      "message": "debug4のSDF帯が全周一様幅で、部位による侵食深さの差が皆無; debug1のシルエットが完全に無傷で、縁の後退(溶け)が確認できない; 静止画のため2時間スケール(溶ける/戻る)は原理的に検証不能",
      "hint": "溶解と再構成を別係数の2時間スケールに分離すること: 侵食は速い時定数(τ≈0.3s)、静止時の実体回復は遅い時定数(τ≈2s)でEMAする(単一時間スケール禁止)"
    },
    {
      "path": "invariants[5]",
      "rule": "aesthetic",
      "severity": "error",
      "message": "debug4のSDF帯が全周一様幅で、部位による侵食深さの差が皆無; debug1のシルエットが完全に無傷で、縁の後退(溶け)が確認できない; 静止画のため2時間スケール(溶ける/戻る)は原理的に検証不能",
      "hint": "注入量の変調だけで済ませないこと: 帯SDFそのものを運動場で押し込み、debug1のシルエット縁が動いた部位で実際に後退して見えることをスクリーンショットで確認する"
    }
  ],
  "requires_human": false,
  "blocked_reason": null,
  "resume_stage": null,
  "cost": {
    "loops": 8,
    "approx_tokens": 290500,
    "wall_minutes": 53
  },
  "pr_url": "https://github.com/dsflon/webgl2/pull/9",
  "updated_at": "2026-07-11T13:29:34.832Z"
}